{"activationBlocked":true,"attempts":[{"attemptDigest":"sha256:3a4344cfdd9911b97281496ea7d014b6b33677bf42157f459458aaec249d87ad","bindings":{"gatewayContractDigest":"sha256:8b07dcc2a7dc458dee5ac2c30159d150f466338533f55c2d92f35ae27dc70e7a","hostProfileDigest":"sha256:08c4713696a35ba732d185fef45c1d76f72a4abdec5aacb26cc05c5e336c60ba","imageDigest":"sha256:4211b15c51742a6b1495f8f2fc0ed965b44668951d854e31cd9b6491344212e6","jobDigest":"sha256:603b5efa061d8cb7e2b9e6389d833deb46349d4a0a931c4b1bc9d306acf3619d","nftablesPolicyDigest":"sha256:df0d30c1ed3d12d2bf43b34d6726da8ae153d74dc233bcaca454c0ce9bd5aa20","planDigest":"sha256:07b9fe87fb9794e3740fbe5d43c02106f77571910638b47515391d831ea75bc0","runtimeManifestDigest":"sha256:92ecbba3243b0026e38218dcb594eaa76272e4883c3dbd00f8257782143c4a13"},"deadlineAt":2000000600000,"expectedOutcome":"registry_npm_tls_sni_tcp443_only","faultProfile":{"kind":"none"},"hostLease":{"createdAt":1999999940000,"dedicated":true,"disposable":true,"expiresAt":2000000900000,"fresh":true,"imageDigest":"sha256:4211b15c51742a6b1495f8f2fc0ed965b44668951d854e31cd9b6491344212e6","initialBootId":"sha256:1f167396b52b24c7da0a0c7b905228bd254daddb617af97b67853ba2a5e441e9","instanceId":"instance-example-01","instanceIdentityDigest":"sha256:fae17dc95f5cf469299ef5c04311a2e5398abe3b2b7ff6596f2b645c6dd614ae","leaseId":"lease-example-01","provider":"example-provider","providerLeaseReceipt":{"controllerPrincipalDigest":"sha256:b3ee9c1d648eeda2f1908cf9295535fedc04bf8f0a3efd2f8853f1d7362ded42","createdAt":1999999940000,"expiresAt":2000000900000,"imageDigest":"sha256:4211b15c51742a6b1495f8f2fc0ed965b44668951d854e31cd9b6491344212e6","instanceId":"instance-example-01","instanceIdentityDigest":"sha256:fae17dc95f5cf469299ef5c04311a2e5398abe3b2b7ff6596f2b645c6dd614ae","kind":"provider_lease_receipt","leaseId":"lease-example-01","provider":"example-provider","providerScopeDigest":"sha256:b99b417b65cfcbf57635eea875e5aff1e5606609d38977c3228d75ff25b1cac2","receiptDigest":"sha256:4af7acaf2f01d819ad6de37996004366af2b4005b2ee546c1c6aca75796a0400"},"providerLeaseReceiptDigest":"sha256:4af7acaf2f01d819ad6de37996004366af2b4005b2ee546c1c6aca75796a0400","providerScopeDigest":"sha256:b99b417b65cfcbf57635eea875e5aff1e5606609d38977c3228d75ff25b1cac2","reused":false,"selfAttested":false},"jobId":"previewjob_aff4291a19bdee8cf33f99f8db804f53ab68bbf0c05ea20fd89f0216989a37b2","scenario":"success","scenarioNonce":"sha256:874792280d13bd66ae080959745f2e4be09b0dd5614ec78413be3efc090a59cb"},{"attemptDigest":"sha256:288bfb1b9a7d2ca18abf6707dde22c8c021e04fd6c706be8de9c9a2ac63ceb0b","bindings":{"gatewayContractDigest":"sha256:7b2902effc5ff503e79244d55478d214eb1f9557f4a175b2f56620a6555a7278","hostProfileDigest":"sha256:1b54de940bb23e926e68364f287ca4aba136f358263ab9edd3fac7236163c771","imageDigest":"sha256:be0f58b87b304592d88e542240224590e93f5e7785337dbab113d6c67e1e01cd","jobDigest":"sha256:dfe5958a164421840a5e33ef781662d2a2075cf8280c332aa7279e32617d287d","nftablesPolicyDigest":"sha256:eea22ea4d67384c5f619104e7cfc75fe63b66f8cf8f71b58a77463e95f53fa14","planDigest":"sha256:62b2288df18eef6e4b86f0fad27db33e25b41155e46f9c22d7ee9a75b180e65a","runtimeManifestDigest":"sha256:7d09ba5d0c5e3b920885e6cc78eca3b5a2dbe36fef8870b61fcaceedf926cd4b"},"deadlineAt":2000000601000,"expectedOutcome":"fail_closed_and_teardown","faultProfile":{"kind":"none"},"hostLease":{"createdAt":1999999940001,"dedicated":true,"disposable":true,"expiresAt":2000000901000,"fresh":true,"imageDigest":"sha256:be0f58b87b304592d88e542240224590e93f5e7785337dbab113d6c67e1e01cd","initialBootId":"sha256:928ec7e470f57ee553edfb6dbbf89505a0ad6929cfdfddf8622842310adf31c2","instanceId":"instance-example-02","instanceIdentityDigest":"sha256:837ed0c1ebe47206ea90cf0e57d2dbe70c0db2d97acb3608faded34b749c0d9f","leaseId":"lease-example-02","provider":"example-provider","providerLeaseReceipt":{"controllerPrincipalDigest":"sha256:b3ee9c1d648eeda2f1908cf9295535fedc04bf8f0a3efd2f8853f1d7362ded42","createdAt":1999999940001,"expiresAt":2000000901000,"imageDigest":"sha256:be0f58b87b304592d88e542240224590e93f5e7785337dbab113d6c67e1e01cd","instanceId":"instance-example-02","instanceIdentityDigest":"sha256:837ed0c1ebe47206ea90cf0e57d2dbe70c0db2d97acb3608faded34b749c0d9f","kind":"provider_lease_receipt","leaseId":"lease-example-02","provider":"example-provider","providerScopeDigest":"sha256:b99b417b65cfcbf57635eea875e5aff1e5606609d38977c3228d75ff25b1cac2","receiptDigest":"sha256:883913400a52c41479ef538b3b44a23d44ffa367cbef07dc280d3ef9f32806c8"},"providerLeaseReceiptDigest":"sha256:883913400a52c41479ef538b3b44a23d44ffa367cbef07dc280d3ef9f32806c8","providerScopeDigest":"sha256:b99b417b65cfcbf57635eea875e5aff1e5606609d38977c3228d75ff25b1cac2","reused":false,"selfAttested":false},"jobId":"previewjob_cd6a727690f378242fe231ee45cf2562888dc3c9e88a9411bca6f31ec5666473","scenario":"timeout","scenarioNonce":"sha256:d96fd8656665ea5b4fe571bbb048998477dd87a7af6a434885f9d18af7663b9c"},{"attemptDigest":"sha256:fb11b76de447ad63cab428b4e92396df8a77be1deea24cee149570a4f6605135","bindings":{"gatewayContractDigest":"sha256:574de6768ecdfcf3f76be2c143f7fa76497a02c6662f2ebb6126787a8b8a5398","hostProfileDigest":"sha256:2a3fed0a83713ffbf338ed1a745cd7d8e24fe3a3e6fa43b0279d61cf0f2bda8a","imageDigest":"sha256:403455aa182971410bf40fb5f41f406a24c2b513c62120c7c1739dcb95b9e2db","jobDigest":"sha256:751416cf74d7eb2b77a092054e2ff3ee1f83f2dc4371d1b015e867c566c7b8c5","nftablesPolicyDigest":"sha256:fb6b7fd4d1354c8a2ecd4bfad2c3664c79a4cf34422b5b934b03c5f5e3eaf8c2","planDigest":"sha256:369ea4198c862e42d8b2ca5f747962acebe9bb82e13ce7b65e3285076455ed5e","runtimeManifestDigest":"sha256:d7541251d9c4f6b548cd044bfcbdfa7953614d07b71c1fdf2644f5fa1f66c585"},"deadlineAt":2000000602000,"expectedOutcome":"fail_closed_and_teardown","faultProfile":{"kind":"none"},"hostLease":{"createdAt":1999999940002,"dedicated":true,"disposable":true,"expiresAt":2000000902000,"fresh":true,"imageDigest":"sha256:403455aa182971410bf40fb5f41f406a24c2b513c62120c7c1739dcb95b9e2db","initialBootId":"sha256:3784f9a3ca69defce5fa510aa2e8e8fa7ccb2ead8f87c4d58d558024d06e83ca","instanceId":"instance-example-03","instanceIdentityDigest":"sha256:13ff89ca072252769d58cebd2055391c281bcbe59da4944c9c2310e7b24ad24d","leaseId":"lease-example-03","provider":"example-provider","providerLeaseReceipt":{"controllerPrincipalDigest":"sha256:b3ee9c1d648eeda2f1908cf9295535fedc04bf8f0a3efd2f8853f1d7362ded42","createdAt":1999999940002,"expiresAt":2000000902000,"imageDigest":"sha256:403455aa182971410bf40fb5f41f406a24c2b513c62120c7c1739dcb95b9e2db","instanceId":"instance-example-03","instanceIdentityDigest":"sha256:13ff89ca072252769d58cebd2055391c281bcbe59da4944c9c2310e7b24ad24d","kind":"provider_lease_receipt","leaseId":"lease-example-03","provider":"example-provider","providerScopeDigest":"sha256:b99b417b65cfcbf57635eea875e5aff1e5606609d38977c3228d75ff25b1cac2","receiptDigest":"sha256:847ed6d07efe655317d694766ee531a61e10497a0a13aa15c1085a5791e55ea5"},"providerLeaseReceiptDigest":"sha256:847ed6d07efe655317d694766ee531a61e10497a0a13aa15c1085a5791e55ea5","providerScopeDigest":"sha256:b99b417b65cfcbf57635eea875e5aff1e5606609d38977c3228d75ff25b1cac2","reused":false,"selfAttested":false},"jobId":"previewjob_939e3628afa4c7293e2efa28078dde26dfdac4ea818fcb0b1a29b2defbae320a","scenario":"sigkill","scenarioNonce":"sha256:115f2f58edb460e1936f549eabfd7e39bcc4d409491c791f328acf2ac1f20466"},{"attemptDigest":"sha256:7f1a786c5a2460bec5105eb776f7a4ebab5038286451d7d47edb1726bc58be61","bindings":{"gatewayContractDigest":"sha256:3ce03c163d2d0420c7cee59962a98cad522f1d997010e719c14a4b842c385e7c","hostProfileDigest":"sha256:5f7879b9b7d65182645104ccf6cd77fea64b0f94159d192804aa284bf6c3e551","imageDigest":"sha256:90b6608bc6bc22737655f28fd8531cc7aeef13678a34be07c7e0c7902c0e46cd","jobDigest":"sha256:635c75699d9273484297bc73861ba9d07991e8da1bb727fd4fd5b126b8149556","nftablesPolicyDigest":"sha256:5ca87591d3fa78612ad0431ac27f9bf78a540eee3a13cd8923c3b1bc436632ec","planDigest":"sha256:130a1b57716eb8a2d4748d631d7d7ea11ddcf4e30a3289b3a4bd7139523581ac","runtimeManifestDigest":"sha256:51412706d8d7ebfbec37c9cd63c13f2b4dbc36afa4db41ec4abed2263d6b0892"},"deadlineAt":2000000603000,"expectedOutcome":"fail_closed_and_teardown","faultProfile":{"allocationBytes":201326592,"cgroupPathDigest":"sha256:ed6af0316a03898e5b6d79a51ba6f74deeea2a2e24009d5b0cd2ea14d500a3a7","cgroupVersion":2,"expectedSystemdResult":"oom-kill","hostMustRemainReachable":true,"kind":"bounded_cgroup_v2_oom","memoryMaxBytes":134217728,"memorySwapMaxBytes":0,"oomKillDeltaMinimum":1,"unitNameDigest":"sha256:ff3e916082778b0bae2149a615f6569714b8a6bbb04d5702589c94be40b1762b"},"hostLease":{"createdAt":1999999940003,"dedicated":true,"disposable":true,"expiresAt":2000000903000,"fresh":true,"imageDigest":"sha256:90b6608bc6bc22737655f28fd8531cc7aeef13678a34be07c7e0c7902c0e46cd","initialBootId":"sha256:ae6b3ecb8b95f261a93c4033eb87126e46db96343c8443eef24848863e4cc48e","instanceId":"instance-example-04","instanceIdentityDigest":"sha256:8bbf537ca3eaf92d22630f3dae5f024866669abc9eac8ee6a73bc649daa680ab","leaseId":"lease-example-04","provider":"example-provider","providerLeaseReceipt":{"controllerPrincipalDigest":"sha256:b3ee9c1d648eeda2f1908cf9295535fedc04bf8f0a3efd2f8853f1d7362ded42","createdAt":1999999940003,"expiresAt":2000000903000,"imageDigest":"sha256:90b6608bc6bc22737655f28fd8531cc7aeef13678a34be07c7e0c7902c0e46cd","instanceId":"instance-example-04","instanceIdentityDigest":"sha256:8bbf537ca3eaf92d22630f3dae5f024866669abc9eac8ee6a73bc649daa680ab","kind":"provider_lease_receipt","leaseId":"lease-example-04","provider":"example-provider","providerScopeDigest":"sha256:b99b417b65cfcbf57635eea875e5aff1e5606609d38977c3228d75ff25b1cac2","receiptDigest":"sha256:1f0211641eaa10db7e5eefc702e06478604406d8b15e4e14a2e1126b54765da3"},"providerLeaseReceiptDigest":"sha256:1f0211641eaa10db7e5eefc702e06478604406d8b15e4e14a2e1126b54765da3","providerScopeDigest":"sha256:b99b417b65cfcbf57635eea875e5aff1e5606609d38977c3228d75ff25b1cac2